{
    "ownerName": "KinsonDigital",
    "repoName": "kd-admin",
    "orgProjectName": "KD-Team",
    "releaseTypes": [{
        "name": "preview",
        "reviewer": "KinsonDigitalAdmin",
        "assignee": "CalvinWilkinson",
        "headBranch": "prev-release",
        "baseBranch": "preview",
        "genReleaseSettingsFilePath": "./gen-release-notes-settings.json",
        "releasePrTemplateFilePath": "./templates/prev-prepare-release-template.md",
        "releaseNotesDirPath": "./release-notes/preview-releases",
        "releaseLabels": ["ðŸš€Preview Release"],
        "prTitle": "ðŸš€Preview Release - ${VERSION}"
    },
    {
        "name": "production",
        "reviewer": "KinsonDigitalAdmin",
        "assignee": "CalvinWilkinson",
        "headBranch": "prod-release",
        "baseBranch": "main",
        "genReleaseSettingsFilePath": "./gen-release-notes-settings.json",
        "releasePrTemplateFilePath": "./templates/prod-prepare-release-template.md",
        "releaseNotesDirPath": "./release-notes/production-releases",
        "releaseLabels": ["ðŸš€Production Release"],
        "prTitle": "ðŸš€Production Release - ${VERSION}"
    }],
    "githubTokenEnvVarName": "CICD_TOKEN"
}
